code,abstract
2021_article_cosmic_ray_spectrum_and_composition_from_pev_to,Cosmic Ray Spectrum and Composition from PeV to EeV from the IceCube Neutrino Observatory arXiv:1908.08139v1 [astro-ph.HE] 21 Aug 2019
2021_article_development_of_crosshair_light_sharing_pet_detector_with_tof,"Objective. Time-of-ﬂight (TOF) and depth-of-interaction (DOI) are well recognized as important information to improve PET image quality. Since such information types are not correlated, many TOF-DOI detectors have been developed but there are only a few reports of high-resolution detectors (e.g. 1.5 mm resolution) for brain PET systems. Based on the DOI detector, which enables single- ended readout by optically coupling a pair of crystals and having a loop structure, we have developed the crosshair light sharing (CLS) PET detector that optically couples the four-loop structure, consisting of quadrisected crystals comparable in size to a photo-sensor, to four photo-sensors in close proximity arranged in a windmill shape. Even as a high-resolution detector, the CLS PET detector could obtain both TOF and DOI information. The coincidence resolving time (CRT) of the CLS PET detector needs to be further improved, however, for application to the brain PET system. Recently, a fast LGSO crystal was developed which has advantages in detection efﬁciency and CRT compared to the GFAG crystal. In this work, we developed the CLS PET detector using the fast LGSO crystal for the TOF-DOI brain PET system. Approach. The crystals were each 1.45×1.45×15 mm3 and all surfaces were chemically etched. The CLS PET detector consisted of a 14×14 crystal array optically coupled to an 8×8 MPPC array. Main results. The fast LGSO array provided 10.1% energy resolution at 511 keV, 4.7 mm DOI resolution at 662 keV, and 293 ps CRT with the energy window of 440–620 keV. Signiﬁcance. The developed CLS PET detector has 290% higher coincidence sensitivity, 30% better energy resolution, and 32% better time resolution compared to our previous CLS PET detector."
2021_article_doi_estimation_through_signal_arrival_time_distribution_a_th,"The challenge to reach 10 ps coincidence time resolution (CTR) in time-of-ﬂight positron emission tomography (TOF-PET) is triggering major efforts worldwide, but timing improvements of scintillation detectors will remain elusive without depth-of-interaction (DOI) correction in long crystals. Nonetheless, this momentum opportunely brings up the prospect of a fully time-based DOI estimation since fast timing signals intrinsically carry DOI information, even with a traditional single- ended readout. Consequently, extracting features of the detected signal time distribution could uncover the spatial origin of the interaction and in return, provide enhancement on the timing precision of detectors. We demonstrate the validity of a time-based DOI estimation concept in two steps. First, experimental measurements were carried out with current LSO:Ce:Ca crystals coupled to FBK NUV-HD SiPMs read out by fast high-frequency electronics to provide new evidence of a distinct DOI effect on CTR not observable before with slower electronics. Using this detector, a DOI discrimination using a double-threshold scheme on the analog timing signal together with the signal intensity information was also developed without any complex readout or detector modiﬁcation. As a second step, we explored by simulation the anticipated performance requirements of future detectors to efﬁciently estimate the DOI and we proposed four estimators that exploit either more generic or more precise features of the DOI-dependent timestamp distribution. A simple estimator using the time difference between two timestamps provided enhanced CTR. Additional improvements were achieved with estimators using multiple timestamps (e.g. kernel density estimation and neural network) converging to the Cramér–Rao lower bound developed in this work for a time-based DOI estimation. This two-step study provides insights on current and future possibilities in exploiting the timing signal features for DOI estimation aiming at ultra-fast CTR while maintaining detection efﬁciency for TOF PET."
2021_article_iso_19005_electronic_document_file_format_for_long_term_pres,"Nuclear Inst. and Methods in Physics Research, A 1001 (2021) 165237"
2021_article_issn_0020_4412_instruments_and_experimental_techniques_2021,"—A complex of four modern scintillation cosmic ray muon telescopes, which are part of the cosmic ray spectrograph after A.I. Kuzmin in Yakutsk, is described. Cosmic-ray detectors of this type are placed on the surface of the Earth, as well as in horizontal cuts that were specially dug in permafrost soils of a mine at depths of 7, 20, and 40 m of the water equivalent, and complement the previously created muon telescopes based on SGM-14 gas-discharge counters. New muon telescopes based on SC-301 scintillation counters have a significantly larger area and accuracy of registering muons of atmospheric origin and allow detection of charged particles from 13 different directions. We also report on a system for recording and transmitting data to a database server located at a distance from the Yakutsk cosmic ray station that operates under the control of the PostgreSQL10 system in real time."
2021_article_issn_1063_7788_physics_of_atomic_nuclei_2021_vol_84_no_6_pp,"—The TRASGO project develops high resolution tracking detectors, sensitive to single electrons and muons as well as to bundles of both kinds of particles. Two detectors are now operative and two more stations will start taking data for atmospheric studies soon. Thanks to the identiﬁcation capability of the detectors, they are well suited to estimate the arrival rates of primary cosmic rays with diﬀerent energy thresholds. This is validated after performing several simulations and opens new possibilities in the research of cosmic rays from ground-based detectors."
2021_article_meca_nica_estadi_stica,Luis Miguel Varela Departamento de Fı́sica de la Materia Condensada Universidad de Santiago de Compostela Tlf. +34881813966 E-mail: luismiguel.varela@usc.es 9 de marzo de 2021 Índice general
2021_article_mu_11a_f_sica_del_estado_s_lido,Summary unavailable from PDF text. Topic: Mu/11a física del estado sólido.
2021_article_on_the_visualisation_of_differential_forms,On the Visualisation of Differential Forms Dan Piponi December 1998
2021_article_online_icrc,ONLINE ICRC ICRC 2021 2021 THE ASTROPARTICLE PHYSICS CONFERENCE Berlin | Ger many THE ASTROPARTICLE PHYSICS CONFERENCE Ber37 lin International th | Ger many Cosmic Ray Conference 12–23 July 2021
2021_article_online_icrc_2,ONLINE ICRC ICRC 2021 2021 THE ASTROPARTICLE PHYSICS CONFERENCE Berlin | Ger many THE ASTROPARTICLE PHYSICS CONFERENCE Ber37 lin International th | Ger many Cosmic Ray Conference 12–23 July 2021
2021_article_prepared_for_submission_to_jinst,"Muon tomography or “muography” is an emerging imaging technique that uses cos- mogenic muons as the radiation source. Due to its diverse range of applications and the use of natural radiation, muography is being applied across many fields such as geology, archaeology, civil engineering, nuclear reactor monitoring, nuclear waste characterization, underground surveys, etc. Muons can be detected using various detector technologies, among which, resistive plate chambers (RPC) are a very cost effective choice. RPCs are planar detectors which use ionization in a thin gas gap to detect cosmic muons, already used since years in major particle accelerator experiments. We have developed a muon telescope (or “muoscope”) composed of small scale RPCs. The design goal for our muoscope is to be portable and autonomous, in order to take data in places that are not easily accessible. The whole setup is light and compact, such to be easily packed in a car trunk. Individual RPCs are hosted in gas-tight aluminium cases. There is no need for gas bottles, once the chambers are filled. The muoscope can be controlled from a reasonable distance using wireless connection. In this paper we summarize the guiding principles of our project and present some recent developments and future prospects, including a long-term stability study of the resistivity of the semiconductive coating obtained with serigraphy."
2021_article_variedades_diferenciables,Esta é a versión imprimible das presentacións utilizadas para impartir a materia “Variedades Diferenciables” durante os cursos 2020-21 e 2021-22 no Grao de Mate- máticas da Universidade de Santiago de Compostela.
2021_article_world_grid_of_cosmic_ray_vertical_cut_off_rigidity_for_the_l,"Cosmic ray cut-oﬀ rigidity tables and maps over the world concerning the epochs 2010, 2015 and the current one 2020 have been constructed. These maps display the eﬀective cut-oﬀ rigidity in every ﬁve degrees in latitude and in longitude at the altitude of 20 km above the surface of the international reference ellipsoid. The values of the geomagnetic cut-oﬀ rigidity were calculated in every 5° in latitude and in every 15° in longitude applying the well-known method of particle trajectory calculations resulted from the theory of the particle motion in the Earth’s magnetic ﬁeld. The applied software employed the 12th Generation of the International Geomagnetic Reference Field (IGRF 12) and trajectories were calculated at 0.01 GV intervals in order to determine the vertical cut-oﬀ rigidity for each location. Beyond the use of the calculated cut-oﬀ rigidity values as a basic reference of charged particle access to diﬀerent geographical locations during quiet and/or more intense geomagnetic periods, these results can be used for a long- term forecasting of the geomagnetic conditions variations. Ó 2021 COSPAR. Published by Elsevier B.V. All rights reserved."
2021_slides_i_ns_s_20_21_aug_us_t_5_t_h_t_hu_s,"1 Physics with Water Cherenkov Detector • Search for a signal in the GUT • Nucleon decay, especially proton decay • Study of neutrino oscillations • (Recent focus on) CP violation and mass hierarchy • by using a variety of neutrino sources • Beam neutrinos, Atmospheric neutrinos, and solar neutrinos • Neutrino Astronomy • Supernova neutrinos • Solar neutrinos • Various astronomical objects"
2021_thesis_a_scintillating_experiment,"Kasper van Dam This work is part of the research programme of the Netherlands Organisation for Scientific Research (NWO). The work is carried out at the National Institute of Subatomic Physics (Nikhef) in Amsterdam, The Netherlands. HiSPARC A SCINTILLATING EXPERIMENT"
2022_article_about_the_necessity_to_build_new_polar_neutron_monitor,About the necessity to build new polar neutron monitor stations
2022_article_cor_system_a_tool_to_evaluate_cosmic_ray_trajectories_in_the,"We present a tool for simulations of cosmic ray trajectories in the magnetosphere called COR (Cut-Oﬀ Rigidity). The COR tool pro- vides a framework oﬀering a wide range of functionalities and the possibility to realize extensive simulations at scalable multicore/multin- ode systems. COR is available at https://cor.crmodels.org. Code used by COR for simulations of cosmic ray trajectories was validated by simulations and results published in a series of articles in the last three decades. In the article, we additionally validated the results of the code by comparison with other available codes. The code for simulations of trajectories is published at GitHub from https://github.com/COR-Cut-oﬀ-rigidity/Trajectories_IGRF_T04_C. Ó 2022 COSPAR. Published by Elsevier B.V. This is an open access article under the CC BY license (http://creativecommons.org/licenses/by/4.0/)."
2022_article_cosmic_ray_observations_from_livingston_island,"ORCA, from the Spanish name Observatorio de Rayos Cósmicos Antártico, is a cosmic ray detector devoted to the observation of secondary cosmic rays at Juan Carlos I Spanish Antarctic Base (62 390 4600 S; 60 230 2000 W , 12 m above sea level). ORCA was installed at the beginning of January 2019 after performing a latitudinal survey from Vigo (Spain) to Livingston Island aboard the Sarmiento de Gamboa Research Vessel. ORCA was in commissioning phase from January 2019 to March 2020, being in normal operation mode from March 2020. A vertical cutoﬀ rigidity of 2:37 GV has been computed at ORCA location and during the ﬁrst year of operation, i. e. from March 2020 to March 2021. ORCA consists of three detectors stacked in a shared structure that maintains the relative distances between the detectors. A muon telescope (ORCM), a neutron monitor without any shielding around (ORCB) and a 3NM64 neutron monitor (ORCA). This conﬁgu- ration allows the measurement of neutron count rates at two diﬀerent energy thresholds, muon count rate and muon incident directions. Measurements recorded during the ﬁrst year of operation and ORCA potential capabilities are shown in this work. Ó 2022 COSPAR. Published by Elsevier B.V. This is an open access article under the CC BY-NC-ND license (http://creativecommons.org/licenses/ by-nc-nd/4.0/)."
2022_article_density_of_gev_muons_in_air_showers_measured_with_icetop,"Density of GeV muons in air showers measured with IceTop R. Abbasi,17 M. Ackermann,61 J. Adams,18 J. A. Aguilar,12 M. Ahlers,22 M. Ahrens,51 J. M. Alameddine,23 A. A. Alves, Jr.,31 N. M. Amin,43 K. Andeen,41 T. Anderson,58 G. Anton,26 C. Argüelles,14 Y. Ashida,39 S. Axani,15 X. Bai,47 A. Balagopal V.,39 S. W. Barwick,30 B. Bastian,61 V. Basu,39 S. Baur,12 R. Bay,8 J. J. Beatty,20,21 K.-H. Becker,60 J. Becker Tjus,11 J. Beise,59 C. Bellenghi,27 S. Benda,39 S. BenZvi,49 D. Berley,19 E. Bernardini,61,† D. Z. Besson,34 G. Binder,8,9 D. Bindig,60 E. Blaufuss,19 S. Blot,61 M. Boddenberg,1 F. Bontempo,31 J. Borowka,1 S. Böser,40 O. Botner,59 J. Böttcher,1 E. Bourbeau,22 F. Bradascio,61 J. Braun,39 B. Brinson,6 S. Bron,28 J. Brostean-Kaiser,61 S. Browne,32 A. Burgman,59 R. T. Burley,2 R. S. Busse,42 M. A. Campana,46 E. G. Carnie-Bronca,2 C. Chen,6 Z. Chen,52 D. Chirkin,39 K. Choi,53 B. A. Clark,24 K. Clark,33 L. Classen,42 A. Coleman,43 G. H. Collin,15 J. M. Conrad,15 P. Coppin,13 P. Correa,13 D. F. Cowen,57,58 R. Cross,49 C. Dappen,1 P. Dave,6 C. De Clercq,13 J. J. DeLaunay,56 D. Delgado López,14 H. Dembinski,43,§ K. Deoskar,51 A. Desai,39 P. Desiati,39 K. D. de Vries,13 G. de Wasseige,36 M. de With,10 T. DeYoung,24 A. Diaz,15 J. C. Díaz-Vélez,39 M. Dittmer,42 H. Dujmovic,31 M. Dunkman,58 M. A. DuVernois,39 T. Ehrhardt,40 P. Eller,27 R. Engel,31,32 H. Erpenbeck,1 J. Evans,19 P. A. Evenson,43 K. L. Fan,19 A. R. Fazely,7 A. Fedynitch,55 N. Feigl,10 S. Fiedlschuster,26 A. T. Fienberg,58 C. Finley,51 L. Fischer,61 D. Fox,57 A. Franckowiak,11,61 E. Friedman,19 A. Fritz,40 P. Fürst,1 T. K. Gaisser,43 J. Gallagher,38 E. Ganster,1 A. Garcia,14 S. Garrappa,61 L. Gerhardt,9 A. Ghadimi,56 C. Glaser,59 T. Glauch,27 T. Glüsenkamp,26 J. G. Gonzalez,43 S. Goswami,56 D. Grant,24 T. Grégoire,58 S. Griswold,49 C. Günther,1 P. Gutjahr,23 C. Haack,27 A. Hallgren,59 R. Halliday,24 L. Halve,1 F. Halzen,39 M. Ha Minh,27 K. Hanson,39 J. Hardin,39 A. A. Harnisch,24 A. Haungs,31 D. Hebecker,10 K. Helbing,60 F. Henningsen,27 E. C. Hettinger,24 S. Hickford,60 J. Hignight,25 C. Hill,16 G. C. Hill,2 K. D. Hoffman,19 R. Hoffmann,60 K. Hoshina,39,‡ F. Huang,58 M. Huber,27 T. Huber,31 K. Hultqvist,51 M. Hünnefeld,23 R. Hussain,39 K. Hymon,23 S. In,53 N. Iovine,12 A. Ishihara,16 M. Jansson,51 G. S. Japaridze,5 M. Jeong,53 M. Jin,14 B. J. P. Jones,4 D. Kang,31 W. Kang,53 X. Kang,46 A. Kappes,42 D. Kappesser,40 L. Kardum,23 T. Karg,61 M. Karl,27 A. Karle,39 U. Katz,26 M. Kauer,39 M. Kellermann,1 J. L. Kelley,39 A. Kheirandish,58 K. Kin,16 T. Kintscher,61 J. Kiryluk,52 S. R. Klein,8,9 R. Koirala,43 H. Kolanoski,10 T. Kontrimas,27 L. Köpke,40 C. Kopper,24 S. Kopper,56 D. J. Koskinen,22 P. Koundal,31 M. Kovacevich,46 M. Kowalski,10,61 T. Kozynets,22 E. Kun,11 N. Kurahashi,46 N. Lad,61 C. Lagunas Gualda,61 J. L. Lanfranchi,58 M. J. Larson,19 F. Lauber,60 J. P. Lazar,14,39 J. W. Lee,53 K. Leonard,39 A. Leszczyńska,32 Y. Li,58 M. Lincetto,11 Q. R. Liu,39 M. Liubarska,25 E. Lohfink,40 C. J. Lozano Mariscal,42 L. Lu,39 F. Lucarelli,28 A. Ludwig,24,35 W. Luszczak,39 Y. Lyu,8,9 W. Y. Ma,61 J. Madsen,39 K. B. M. Mahn,24 Y. Makino,39 S. Mancina,39 I. C. Mariş,12 I. Martinez-Soler,14 R. Maruyama,44 S. McCarthy,39 T. McElroy,25 F. McNally,37 J. V. Mead,22 K. Meagher,39 S. Mechbal,61 A. Medina,21 M. Meier,16 S. Meighen-Berger,27 J. Micallef,24 D. Mockler,12 T. Montaruli,28 R. W. Moore,25 R. Morse,39 M. Moulai,15 R. Naab,61 R. Nagai,16 U. Naumann,60 J. Necker,61 L. V. Nguyễn,24 H. Niederhausen,24 M. U. Nisa,24 S. C. Nowicki,24 A. Obertacke Pollmann,60 M. Oehler,31 B. Oeyen,29 A. Olivas,19 E. O’Sullivan,59 H. Pandya,43 D. V. Pankova,58 N. Park,33 G. K. Parker,4 E. N. Paudel,43 L. Paul,41 C. Pérez de los Heros,59 L. Peters,1 J. Peterson,39 S. Philippen,1 S. Pieper,60 M. Pittermann,32 A. Pizzuto,39 M. Plum,47 Y. Popovych,40 A. Porcelli,29 M. Prado Rodriguez,39 B. Pries,24 G. T. Przybylski,9 C. Raab,12 J. Rack-Helleis,40 A. Raissi,18 M. Rameez,22 K. Rawlins,3 I. C. Rea,27 Z. Rechav,39 A. Rehman,43 P. Reichherzer,11 R. Reimann,1 G. Renzi,12 E. Resconi,27 S. Reusch,61 W. Rhode,23 M. Richman,46 B. Riedel,39 E. J. Roberts,2 S. Robertson,8,9 G. Roellinghoff,53 M. Rongen,40 C. Rott,50,53 T. Ruhe,23 D. Ryckbosch,29 D. Rysewyk Cantu,24 I. Safa,14,39 J. Saffer,32 S. E. Sanchez Herrera,24 A. Sandrock,23 M. Santander,56 S. Sarkar,45 S. Sarkar,25 K. Satalecka,61 M. Schaufel,1 H. Schieler,31 S. Schindler,26 T. Schmidt,19 A. Schneider,39 J. Schneider,26 F. G. Schröder,31,43 L. Schumacher,27 G. Schwefer,1 S. Sclafani,46 D. Seckel,43 S. Seunarine,48 A. Sharma,59 S. Shefali,32 N. Shimizu,16 M. Silva,39 B. Skrzypek,14 B. Smithers,4 R. Snihur,39 J. Soedingrekso,23 D. Soldin,43 C. Spannfellner,27 G. M. Spiczak,48 C. Spiering,61 J. Stachurska,61 M. Stamatikos,21 T. Stanev,43 R. Stein,61 J. Stettner,1 T. Stezelberger,9 T. Stürwald,60 T. Stuttard,22 G. W. Sullivan,19 I. Taboada,6 S. Ter-Antonyan,7 J. Thwaites,39 S. Tilav,43 F. Tischbein,1 K. Tollefson,24 C. Tönnis,54 S. Toscano,12 D. Tosi,39 A. Trettin,61 M. Tselengidou,26 C. F. Tung,6 A. Turcati,27 R. Turcotte,31 C. F. Turley,58 J. P. Twagirayezu,24 B. Ty,39 M. A. Unland Elorrieta,42 N. Valtonen-Mattila,59 J. Vandenbroucke,39 N. van Eijndhoven,13 D. Vannerom,15 J. van Santen,61 J. Veitch-Michaelis,39 S. Verpoest,29 C. Walck,51 W. Wang,39 T. B. Watson,4 C. Weaver,24 P. Weigel,15 A. Weindl,31 M. J. Weiss,58 J. Weldert,40 C. Wendt,39 J. Werthebach,23 M. Weyrauch,32 N. Whitehorn,24,35 C. H. Wiebusch,1 D. R. Williams,56 M. Wolf,39 G. Wrede,26 J. Wulff,11 X. W. Xu,7 J. P. Yanez,25 E. Yildizci,39 S. Yoshida,16 S. Yu,24 T. Yuan,39 Z. Zhang,52 and P. Zhelnin14"
2022_article_facultade_de_f_sica,"CALIFA detector is a gamma and light charged particle calorimeter that is part of the R3 B complete and inverse kinematics experiment located at the GSI-FAIR. CALIFA is composed of 2544 CsI(Tl) scintillator units attached to APD-type solid-state detectors assembled in the shape of a capped barrel around a collision target. This detector is essentially made up of two parts: the Barrel, the central body, and the EndCap, the front part, which in turn is subdivided into iPhos and CEPA, the Very Forward part, which is still in construction. All CALIFA is made up of crystals, although of dierent geometry, of the same material. Our objective is to study the viability of introducing a GAGG-CsI(Tl) Phoswich (Phosphor Sandwich) in CEPA to achieve a more complete characterization of the particles that travel in this angular range. To this end, an order was made for four GAGG units from Epic Crystal Co., Ltd (China) in lengths of 70, 80, 90 and 100 mm with the aim of characterizing them, bonding them to CsI(Tl) pieces of complementary size and assembling an alveolus of a petal of CEPA. However, manufacturing errors meant that only two of the four GAGG ordered were received, which also showed visual defects, such as turbidity or white spots, at the time of arrival at the laboratory, and whose characterization showed frontal resolutions of 13 % for the 80 mm and 14 % for the 90 mm, disproportionate for the 7 % indicated by the company or the 9 % obtained from a 50 mm long GAGG in Phoswich scintillator assembly for medical imaging (PHARMI). Introducción La Helmholtz Association está integrada por 18 centros de investigación de todo el pla- neta, entre los que se cuenta el GSI Helmholtzzentrum für Schwerionenforschung, empresa alemana dedicada a gestionar una importante red de aceleradores. Prestan sus instalacio- nes al consorcio internacional de Instalaciones para Investigación en Antiprotones e Iones (FAIR), complejo ubicado en Darmstadt que acoge, entre otros, el experimento de Reac- ciones con Haces Radiactivos Relativistas (R3 B) del que el calorímetro para partículas cargadas ligeras y gammas (CALIFA) forma parte."
2022_article_fieldable_muon_spectrometer_using_multi_layer_pressurized_ga,"OPEN Fieldable muon spectrometer using multi‑layer pressurized gas Cherenkov radiators and its applications Junghyun Bae* & Stylianos Chatzidakis Cosmic ray muons have been considered as a non-conventional radiation probe in various applications. To utilize cosmic ray muons in engineering applications, two important quantities, trajectory and momentum, must be known. The muon trajectories are easily reconstructed using two-fold detector arrays with a high spatial resolution. However, precise measurement of muon momentum is difficult to be achieved without deploying large and expensive spectrometers such as solenoid magnets. Here, we propose a new method to estimate muon momentum using multi-layer pressurized gas Cherenkov radiators. This is accurate, portable, compact (< ­1m3), and easily coupled with existing muon detectors without the need of neither bulky magnetic nor time-of-flight spectrometers. The results show that not only our new muon spectrometer can measure muon momentum with a resolution of ± 0.5 GeV/c in a momentum range of 0.1–10.0 GeV/c, but also we can reconstruct cosmic muon spectrum with high accuracy (~ 90%)."
2022_article_iso_19005_electronic_document_file_format_for_long_term_pres,"Nuclear Inst. and Methods in Physics Research, A 1046 (2023) 167695"
