code,abstract
2013_article_lectures_on_quantum_mechanics,"Nobel Laureate Steven Weinberg combines his exceptional physical insight with his gift for clear exposition to provide a concise introduction to modern quantum mechanics. Ideally suited to a one-year graduate course, this textbook is also a use- ful reference for researchers. Readers are introduced to the subject through a review of the history of quantum mechanics and an account of classic solu- tions of the Schrödinger equation, before quantum mechanics is developed in a modern Hilbert space approach. The textbook covers many topics not often found in other books on the subject, including alternatives to the Copenhagen interpretation, Bloch waves and band structure, the Wigner–Eckart theorem, magic numbers, isospin symmetry, the Dirac theory of constrained canonical systems, general scattering theory, the optical theorem, the “in-in” formalism, the Berry phase, Landau levels, entanglement, and quantum computing. Prob- lems are included at the ends of chapters, with solutions available for instructors at www.cambridge.org/LQM."
2013_article_solar_phys_2013_284_167_178,"In this work, non-recurrent Forbush decreases (FDs) triggered by the passage of shock-driving interplanetary coronal mass ejections (ICMEs) have been analyzed. Fifty- nine ICMEs have been studied, but only 25 % of them were associated to a FD. We find that shock-driving magnetic clouds (MCs) produce deeper FDs than shock-driving ejecta. This fact can be explained regarding the observed growing trends between decreases in neutron monitor (NM) count rate and MC/ejecta speed and its associated rigidity. MCs are faster and have higher associated rigidities than ejecta. Also the deceleration of ICMEs seems to be a cause for producing FDs, as can be inferred from the decreasing trend between NM count rate and deceleration. This probably implies that the interaction between the ICME traveling from the corona to the Earth and the solar wind can play an important role in producing deeper FDs. Finally, we conclude that ejecta without flux rope topology are the ones less effective in unchaining FDs."
2013_article_sun_and_geosphere_2012_7_1_65_70_issn_1819_0839,". The geomagnetic field (Bgeo) sets a lower cutoff rigidity (RC) to the entry of cosmic particles to Earth which depends on the geomagnetic activity. From numerical simulations of the trajectory of a proton using different models for Bgeo (performed with the MAGCOS code), we use backtracking to analyze particles arriving at the location of two nodes of the net LAGO (Large Aperture Gamma ray burst Observatory) that will be built in the near future: Buenos Aires and Marambio (Antarctica), Argentina. We determine the asymptotic trajectories and the values of RC for different incidence directions, for each node. Simulations were done using several models for Bgeo that emulate different geomagnetic conditions. The presented results will help to make analysis of future observations of the flux of cosmic rays done at these two LAGO nodes."
2013_book_introduction_to_electrodynamics,INTRODUCTION TO ELECTRODYNAMICS This page intentionally left blank INTRODUCTION TO ELECTRODYNAMICS
2013_book_iso_15930_electronic_document_file_format_for_prepress_digit,Summary unavailable from PDF text. Topic: Iso 15930 electronic document file format for prepress digital data exchange (pdf/x).
2013_book_modern_particle_physics,trace formalism is introduced.
2013_book_numericaloptimization,Springer Springer Series in Operations Research Editors: Peter Glynn Stephen M. Robinson
2013_book_undergraduate_lecture_notes_in_physics,Summary unavailable from PDF text. Topic: Undergraduate lecture notes in physics.
2013_slides_flavio_loddo,Flavio Loddo Istituto Nazionale di Fisica Nucleare – Sez.di Bari (Italy) flavio.loddo@ba.infn.it Outline
2013_slides_introduction_to_the_micropattern,Electrons liberated by ionization drift towards the anode wire.
2014_article_layered_water_cherenkov_detector_for_the_study_of_ultra_high,Nuclear Instruments and Methods in Physics Research A 767 (2014) 41–49
2014_article_mandrikova_et_al_earth_planets_and_space_2014_66_148,"In the present paper, we propose a wavelet-based method of describing variations in the Earth’s magnetic field, such as the horizontal component of the geomagnetic field, in addition to methods for evaluating changes in the energy characteristics of the field and for isolating the periods of increased geomagnetic activity. Based on a combination of multiresolution wavelet decompositions with neural networks, we propose a method of approximation of the cosmic ray time course and the allocation of anomalous variations (Forbush effects) that occur during periods of high solar activity. During the realization of the method, an algorithm was created for selecting the level of the wavelet decomposition and adaptive construction of the neural network. By using the proposed methods, we performed a joint analysis of the geomagnetic field and cosmic rays during periods of strong magnetic storms. The strongest geomagnetic field perturbations were observed in periods of abnormal changes in cosmic ray level. Assessment of the intensity of geomagnetic disturbances on the eve of and during magnetic storm development allowed us to highlight local increases in intensity of the geomagnetic field occurring at different frequency ranges prior to the development of the storm’s main phase. Implementation of the proposed method with theoretical tools in combination with other methods will improve the estimation accuracy of the geomagnetic field state during space weather forecasting. Keywords: Geomagnetic field; Cosmic rays; Wavelet transform; Neural networks; Magnetic storms"
2014_article_space_sci_rev_2014_182_1_18,"In this work, we summarize the development and current status of the Global Muon Detector Network (GMDN). The GMDN started in 1992 with only two muon detec- tors. It has consisted of four detectors since the Kuwait-city muon hodoscope detector was installed in March 2006. The present network has a total of 60 directional channels with an improved coverage of the sunward Interplanetary Magnetic Field (IMF) orientation, making"
2014_article_zenith_angle_sensitivity_of_a_cubical_meson_telescope,Zenith Angle Sensitivity of a Cubical Meson Telescope N. R. Parsons
2014_book_quantum_field_theory_for_the_gifted,Summary unavailable from PDF text. Topic: Quantum field THEory FOR THE gifted.
2014_book_radiation_detection_and_measurement,Summary unavailable from PDF text. Topic: Radiation detection and measurement.
2015_article_local_anisotropy_of_muon_flux_the_basis_of_the_method_of_muo,A new method for the analysis of spatial and angular characteristics of the cosmic ray muon ﬂux registered in the hodoscopic mode using a single setup – the muon hodoscope – is presented. Various parameters of the muon ﬂux anisotropy and methods of calculation of these parameters are discussed. It is shown that the horizontal projection of the muon ﬂux relative anisotropy vector which characterizes lateral (horizontal) displacement of the muon ﬂux angular distribution is the sensitive parameter to a variety of nonstationary processes in the heliosphere. The experimental data on the variation of the muon ﬂux anisotropy during the passage of various irregularities in the solar wind and interplanetary magnetic ﬁeld in the Earth’s vicinity are presented. Ó 2015 COSPAR. Published by Elsevier Ltd. All rights reserved.
2015_article_programa_de_fi_sica,"1. Propiedades generales de los núcleos. 8 1.1. Introducción. Definiciones. . . . . . . . . . . . . . . . . . . . . . . . . . . . . . . . . . . . . 8 1.1.1. Tipos de desintegraciones. . . . . . . . . . . . . . . . . . . . . . . . . . . . . . . . . 9 1.2. Masas de los núcleos. . . . . . . . . . . . . . . . . . . . . . . . . . . . . . . . . . . . . . . . 11 1.2.1. Espectrometrı́a de masas. . . . . . . . . . . . . . . . . . . . . . . . . . . . . . . . . 11 1.2.2. Energı́a de ligadura. Energı́as de separación. Números mágicos. . . . . . . . . . . . 13 1.2.3. Fórmula semiempı́rica de masas, o fórmula de Weizsäcker. . . . . . . . . . . . . . . 16 1.2.4. Aplicaciones de la fórmula semiempı́rica de Weizsäcker. Parábola de masas. . . . . 17 1.3. Abundancia y estabilidad nuclear. . . . . . . . . . . . . . . . . . . . . . . . . . . . . . . . 18 1.4. Tamaño de los núcleos. . . . . . . . . . . . . . . . . . . . . . . . . . . . . . . . . . . . . . . 21 1.4.1. Introducción. . . . . . . . . . . . . . . . . . . . . . . . . . . . . . . . . . . . . . . . 21 1.4.2. Sección eficaz diferencial y sección eficaz total. . . . . . . . . . . . . . . . . . . . . 23 1.4.3. Sección eficaz de Rutherford. . . . . . . . . . . . . . . . . . . . . . . . . . . . . . . 24 1.4.4. Factor de forma nuclear. . . . . . . . . . . . . . . . . . . . . . . . . . . . . . . . . . 28 1.4.5. Ejemplos de factores de forma. . . . . . . . . . . . . . . . . . . . . . . . . . . . . . 29 1.4.6. Otros métodos de determinación de tamaños nucleares. . . . . . . . . . . . . . . . 33 Desplazamiento isotópico. . . . . . . . . . . . . . . . . . . . . . . . . . . . . . . . . 33 Núcleos espejo. . . . . . . . . . . . . . . . . . . . . . . . . . . . . . . . . . . . . . . 35 1.5. Espines y momentos nucleares. . . . . . . . . . . . . . . . . . . . . . . . . . . . . . . . . . 37 1.5.1. Espines y paridades. . . . . . . . . . . . . . . . . . . . . . . . . . . . . . . . . . . . 37 1.5.2. Momentos cuadrupolar eléctrico y dipolar magnético. . . . . . . . . . . . . . . . . 38 Momento dipolar magnético. . . . . . . . . . . . . . . . . . . . . . . . . . . . . . . 39 Momento cuadrupolar eléctrico. . . . . . . . . . . . . . . . . . . . . . . . . . . . . . 40 1.5.3. Estructura hiperfina. . . . . . . . . . . . . . . . . . . . . . . . . . . . . . . . . . . . 41"
2015_article_ram_n_bravo,"Introducción al lenguaje Python (2.7) Grado en Física, Facultad de Física Universidad de Santiago de Compostela"
2015_article_ram_n_bravo_2,"Introducción al lenguaje Python (2.7) Grado en Física, Facultad de Física Universidad de Santiago de Compostela"
2015_book_f_sica_nuclear_y_de_part_culas,Summary unavailable from PDF text. Topic: Física nuclear y de partículas.
2016_article_the_pierre_auger_observatory_upgrade,"Observatorio Pierre Auger, Av. San Martı́n Norte 304, 5613 Malargüe, Argentina OBSERVATORY ii The Pierre Auger Collaboration, April 2015 A. Aab41 , P. Abreu65 , M. Aglietta52 , E.J. Ahn82 , I. Al Samarai28 , I.F.M. Albuquerque16 , I. Allekotte1 , P. Allison87 , A. Almela11, 8 , J. Alvarez Castillo58 , J. Alvarez-Muñiz75 , R. Alves Batista40 , M. Ambrosio43 , A. Aminaei59 , L. Anchordoqui81 , S. Andringa65 , C. Aramo43 , F. Arqueros72 , N. Arsene68 , H. Asorey1, 24 , P. Assis65 , J. Aublin30 , M. Ave1 , M. Avenier31 , G. Avila10 , N. Awal85 , A.M. Badescu69 , K.B. Barber12 , J. Bäuml35 , C. Baus35 , J.J. Beatty87 , K.H. Becker34 , J.A. Bellido12 , C. Berat31 , M.E. Bertaina52 , X. Bertou1 , P.L. Biermann38 , P. Billoir30 , S.G. Blaess12 , A. Blanco65 , M. Blanco30 , J. Blazek26 , C. Bleve47 , H. Blümer35, 36 , M. Boháčová26 , D. Boncioli51 , C. Bonifazi22 , N. Borodai63 , J. Brack79 , I. Brancus66 , A. Bridgeman36 , P. Brogueira65 , W.C. Brown80 , P. Buchholz41 , A. Bueno74 , S. Buitink59 , M. Buscemi43 , K.S. Caballero-Mora56 , B. Caccianiga42 , L. Caccianiga30 , M. Candusso44 , L. Caramete67 , R. Caruso45 , A. Castellina52 , G. Cataldi47 , L. Cazon65 , R. Cester46 , A.G. Chavez57 , A. Chiavassa52 , J.A. Chinellato17 , J. Chudoba26 , M. Cilmo43 , R.W. Clay12 , G. Cocciolo47 , R. Colalillo43 , A. Coleman88 , L. Collica42 , M.R. Coluccia47 , R. Conceição65 , F. Contreras9 , M.J. Cooper12 , A. Cordier29 , S. Coutu88 , C.E. Covault77 , J. Cronin89 , R. Dallier33, 32 , B. Daniel17 , S. Dasso5, 3 , K. Daumiller36 , B.R. Dawson12 , R.M. de Almeida23 , S.J. de Jong59, 61 , G. De Mauro59 , J.R.T. de Mello Neto22 , I. De Mitri47 , J. de Oliveira23 , V. de Souza15 , L. del Peral73 , O. Deligny28 , H. Dembinski36 , N. Dhital84 , C. Di Giulio44 , A. Di Matteo48 , J.C. Diaz84 , M.L. Dı́az Castro17 , F. Diogo65 , C. Dobrigkeit 17 , W. Docters60 , J.C. D’Olivo58 , A. Dorofeev79 , Q. Dorosti Hasankiadeh36 , M.T. Dova4 , J. Ebr26 , R. Engel36 , M. Erdmann39 , M. Erfani41 , C.O. Escobar82, 17 , J. Espadanal65 , A. Etchegoyen8, 11 , H. Falcke59, 62, 61 , K. Fang89 , G. Farrar85 , A.C. Fauth17 , N. Fazzini82 , A.P. Ferguson77 , M. Fernandes22 , B. Fick84 , J.M. Figueira8 , A. Filevich8 , A. Filipčič70, 71 , B.D. Fox90 , O. Fratu69 , M.M. Freire6 , B. Fuchs35 , T. Fujii89 , B. Garcı́a7 , D. Garcia-Pinto72 , F. Gate33 , H. Gemmeke37 , A. Gherghel-Lascu66 , P.L. Ghia30 , U. Giaccari22 , M. Giammarchi42 , M. Giller64 , D. Głas64 , C. Glaser39 , H. Glass82 , G. Golup1 , M. Gómez Berisso1 , P.F. Gómez Vitale10 , N. González8 , B. Gookin79 , J. Gordon87 , A. Gorgi52 , P. Gorham90 , P. Gouffon16 , N. Griffith87 , A.F. Grillo51 , T.D. Grubb12 , F. Guarino43 , G.P. Guedes18 , M.R. Hampel8 , P. Hansen4 , D. Harari1 , T.A. Harrison12 , S. Hartmann39 , J.L. Harton79 , A. Haungs36 , T. Hebbeker39 , D. Heck36 , P. Heimann41 , N. Hemery36 , A.E. Herve36 , G.C. Hill12 , C. Hojvat82 , N. Hollon89 , E. Holt36 , P. Homola34 , J.R. Hörandel59, 61 , P. Horvath27 , M. Hrabovský27, 26 , D. Huber35 , T. Huege36 , A. Insolia45 , P.G. Isar67 , I. Jandt34 , S. Jansen59, 61 , C. Jarne4 , J.A. Johnsen78 , M. Josebachuili8 , A. Kääpä34 , O. Kambeitz35 , K.H. Kampert34 , P. Kasper82 , I. Katkov35 , B. Kégl29 , B. Keilhauer36 , A. Keivani88 , E. Kemp17 , R.M. Kieckhafer84 , H.O. Klages36 , M. Kleifges37 , J. Kleinfeller9 , R. Krause39 , N. Krohm34 , O. Krömer37 , D. Kuempel39 , G. Kukec Mezek71 , N. Kunka37 , D. LaHurd77 , L. Latronico52 , R. Lauer92 , M. Lauscher39 , P. Lautridou33 , S. Le Coz31 , D. Lebrun31 , P. Lebrun82 , M.A. Leigui de Oliveira21 , A. Letessier-Selvon30 , I. Lhenry-Yvon28 , K. Link35 , L. Lopes65 , R. López53 , A. López Casado75 , K. Louedec31 , L. Lu34, 9999 , A. Lucero8 , M. Malacari12 , S. Maldera52 , M. Mallamaci42 , J. Maller33 , D. Mandat26 , P. Mantsch82 , A.G. Mariazzi4 , V. Marin33 , I.C. Mariş74 , G. Marsella47 , D. Martello47 , L. Martin33, 32 , H. Martinez54 , O. Martı́nez Bravo53 , D. Martraire28 , J.J. Ması́as Meza3 , H.J. Mathes36 , S. Mathys34 , J. Matthews83 , J.A.J. Matthews92 , G. Matthiae44 , D. Maurizio13 , E. Mayotte78 , P.O. Mazur82 , C. Medina78 , G. Medina-Tanco58 , R. Meissner39 , V.B.B. Mello22 , D. Melo8 , A. Menshikov37 , S. Messina60 , R. Meyhandan90 , M.I. Micheletti6 , L. Middendorf39 , I.A. Minaya72 , L. Miramonti42 , B. Mitrica66 , L. Molina-Bueno74 , S. Mollerach1 , F. Montanet31 , C. Morello52 , M. Mostafá88 , C.A. Moura21 , M.A. Muller17, 20 , G. Müller39 , S. Müller36 , R. Mussa46 , G. Navarra52 ‡ , S. Navas74 , P. Necesal26 , L. Nellen58 , A. Nelles59, 61 , J. Neuser34 , P.H. Nguyen12 , M. Niculescu-Oglinzanu66 , M. Niechciol41 , L. Niemietz34 , T. Niggemann39 , D. Nitz84 , D. Nosek25 , V. Novotny25 , L. Nožka27 , L. Ochilo41 , F. Oikonomou88 , A. Olinto89 , N. Pacheco73 , D. Pakk Selmi-Dei17 , M. Palatka26 , J. Pallotta2 , P. Papenbreer34 , G. Parente75 ,"
2016_article_the_temperature_effect_in_secondary_cosmic_rays_muons_observ,"The analysis of cosmic ray intensity variation seen by muon detectors at Earthʼs surface can help us to understand astrophysical, solar, interplanetary and geomagnetic phenomena. However, before comparing cosmic ray intensity variations with extraterrestrial phenomena, it is necessary to take into account atmospheric effects such as the temperature effect. In this work, we analyzed this effect on the Global Muon Detector Network (GMDN), which is composed of four ground-based detectors, two in the northern hemisphere and two in the southern hemisphere. In general, we found a higher temperature inﬂuence on detectors located in the northern hemisphere. Besides that, we noticed that the seasonal temperature variation observed at the ground and at the altitude of maximum muon production are in antiphase for all GMDN locations (low-latitude regions). In this way, contrary to what is expected in high-latitude regions, the ground muon intensity decrease occurring during summertime would be related to both parts of the temperature effect (the negative and the positive). We analyzed several methods to describe the temperature effect on cosmic ray intensity. We found that the mass weighted method is the one that best reproduces the seasonal cosmic ray variation observed by the GMDN detectors and allows the highest correlation with long-term variation of the cosmic ray intensity seen by neutron monitors. Key words: atmospheric effects – cosmic rays – solar–terrestrial relations – Sun: general"
2016_book_gravitation,Summary unavailable from PDF text. Topic: Gravitation.
2017_article_analysis_of_ground_level_enhancements_gle_extreme_solar_ener,"Nearly 70 Ground Level Enhancements (GLEs) of cosmic rays have been recorded by the worldwide neutron monitor network since the 1950s depicting a big variety of energy spectra of solar energetic particles (SEP). Here we studied a statistical relation between the event-integrated intensity of GLEs (calculated as count-rate relative excess, averaged over all available polar neutron monitors, and expressed in percent-hours) and the hardness of the solar particle energy spectra. For each event the integral omnidirectional event- integrated ﬂuences of particles with energy above 30 MeV (F 30 ) and above 200 MeV (F 200 ) were computed using the reconstructed spec- tra, and the ratio between the two ﬂuences was considered as a simple index of the event’s hardness. We also provided a justiﬁcation of the spectrum estimate in the form of the Band-function, using direct PAMELA data for GLE 71 (17-May-2012). We found that, while there is no clear relation between the intensity and the hardness for weak events, all strong events with the intensity greater 100 %*h are characterized by a very hard spectrum. This implies that a hard spectrum can be securely assumed for all extreme GLE events, e.g., those studied using cosmogenic isotope data in the past. Ó 2016 COSPAR. Published by Elsevier Ltd. All rights reserved."
2017_article_griffiths_quantum,Summary unavailable from PDF text. Topic: Griffiths quantum.
2017_article_iso_19005_electronic_document_file_format_for_long_term_pres,"Nuclear Inst. and Methods in Physics Research, A 878 (2018) 169–179"
2017_article_kittel_introducci_n_a_la_f_sica_del_estado_s_li,Summary unavailable from PDF text. Topic: Kittel introducci n a la f sica del estado s li.
2017_article_xxv_european_cosmic_ray_symposium_turin_sept_4_9_2016_1,"TRAGALDABAS. First results on cosmic ray studies and their relation with the solar activity, the Earth’s magnetic field and the atmospheric properties"
2017_book_157732_print_indd,Summary unavailable from PDF text. Topic: 157732 print indd.
2017_book_curso_de_astronomia_abad_correcto,Summary unavailable from PDF text. Topic: Curso de astronomia abad correcto.
2017_slides_in_vivo_and_in_beam_monitoring_of_pet,In-vivo and in-beam monitoring of PET activation in proton therapy: tests in a chicken 18 embryo model with O-enriched water
2018_article_fnexp_master_guiondigital,Universidad Complutense de Madrid jose@nuc2.fis.ucm.es Grupo de Física Nuclear
2018_article_iso_19005_electronic_document_file_format_for_long_term_pres,"Nuclear Inst. and Methods in Physics Research, A 916 (2019) 1–7"
2018_article_maza_2008_f_sica_del_estado_s_lido,Summary unavailable from PDF text. Topic: Maza 2008 f sica del estado s lido.
2018_article_the_cosmicwatch_desktop_muon_detector_a_self_contained_pocke,"The CosmicWatch Desktop Muon Detector is a self-contained, hand-held cosmic ray muon detector that is valuable for astro/particle physics research applications and outreach. The material cost of each detector is under 100$ and it takes a novice student approximately four hours to build their first detector. The detectors are powered via a USB connection and the data can either be recorded directly to a computer or to a microSD card. Arduino- and Python-based software is provided to operate the detector and an online application to plot the data in real-time. In this paper, we describe the various design features, evaluate the performance, and illustrate the detectors capabilities by providing several example measurements."
2018_article_the_influence_of_several_atmospheric_variables_on_cosmic_ray,"In this study, the eﬀects of atmospheric pressure and temperature on cosmic ray muons have been investigated using data recorded by the KACST detector (Riyadh, Saudi Arabia; Rc = 14.4 GV) for the beginning of the quiet periods of the 24th solar cycle. The muon data were, initially, correlated with the atmospheric pressure, and the desired coeﬃcient was obtained and used to eliminate the pressure eﬀect from the muon measurements. The pressure-corrected data are then analysed to study the eﬀect of the atmospheric temperature on cos- mic ray muons, using ﬁve methods. Four methods investigate the eﬀect of the ground temperature, the atmospheric temperatures and atmospheric heights at several atmospheric levels, on the measured muon rate. In the ﬁfth method, the muon data were correlated with the atmospheric weighted temperatures integrated up to diﬀerent atmospheric heights. For all cases, the desired correction coeﬃcients were obtained, and their variations at several atmospheric levels were studied. The obtained coeﬃcients were then used to correct the cosmic ray data. We found that the atmospheric pressure eﬀect shows the greatest diﬀerences between the corrected and uncorrected rate (up to 1%). Instead, corrections made to the muon data using the remainder of the considered parameters modify the muon rate by a small amount (less than 0.5%) compared to the uncorrected rate. Ó 2018 COSPAR. Published by Elsevier Ltd. All rights reserved."
2018_article_the_sevan_worldwide_network_of_particle_detectors_10_years_o,"The Space Environment Viewing and Analysis Network (SEVAN) aims to improve the fundamental research on particle acceleration in the vicinity of the sun, on space weather eﬀects and on high-energy physics in the atmosphere and lightning initiation. This new type of a particle detector setup simultaneously measures ﬂuxes of most species of secondary cosmic rays, thus being a powerful integrated device for exploration of solar modulation eﬀects and electron acceleration in the thunderstorm atmosphere. The SEVAN modules are oper- ating at the Aragats Space Environmental Center (ASEC) in Armenia, in Croatia, Bulgaria, Slovakia, the Czech Republic (from 2017) and in India. In this paper, we present the most interesting results of the SEVAN network operation during the last decade. We present this review on the occasion of the 10th anniversary of the International Heliophysical Year in 2007. Ó 2018 COSPAR. Published by Elsevier Ltd. All rights reserved."
2018_book_resistive_gaseous_detectors,"Marcello Abbrescia, Vladimir Peskov, and Paulo Fonte Authors All books published by Wiley-VCH are carefully produced. Nevertheless, authors, Prof. Marcello Abbrescia editors, and publisher do not warrant the Department of Physics information contained in these books, University of Bari including this book, to be free of errors. and Sezione INFN Readers are advised to keep in mind that 70126 Bari statements, data, illustrations, procedural Italy details or other items may inadvertently be inaccurate. Prof. Paulo Fonte Polytechnic Institute of Coimbra Library of Congress Card No.: applied for Coimbra Institute of Engineering Rua Pedro Nunes British Library Cataloguing-in-Publication 3030-199 Coimbra Data Portugal A catalogue record for this book is avail- able from the British Library. and Laboratory of Instrumentation and Bibliographic information published by Experimental Particle Physics (LIP) the Deutsche Nationalbibliothek Physics Department The Deutsche Nationalbibliothek University of Coimbra lists this publication in the Deutsche 3004-516 Coimbra Nationalbibliograﬁe; detailed Portugal bibliographic data are available on the Internet at <http://dnb.d-nb.de>. Prof. Vladimir Peskov CERN PH-UAI © 2018 Wiley-VCH Verlag GmbH & Co. 581/R-015 KGaA, Boschstr. 12, 69469 Weinheim, 1211 Geneva 23 Germany Switzerland All rights reserved (including those of Cover Images: (Background image) © translation into other languages). No part teekid/Gettyimages; of this book may be reproduced in any (Illustration) © Wiley form – by photoprinting, microﬁlm, or any other means – nor transmitted or translated into a machine language without written permission from the publishers. Registered names, trademarks, etc. used in this book, even when not speciﬁcally marked as such, are not to be considered unprotected by law."
2018_slides_la_f_sica_nuclear_y_de,LA FÍSICA NUCLEAR Y DE PARTÍCULAS Y SUS APLICACIONES EN MEDICINA
2018_thesis_tesis_de_doctorado,SIMULATION AND RECONSTRUCTION ALGORITHMS FOR A COMMERCIAL MUON TOMOGRAPHY SYSTEM
