code,abstract
2025_article_j_astrophys_astr_2025_46_31_indian_academy_of_sciences,". Radio detection of cosmic rays investigates the electromagnetic component of extensive air show- ers. It is possible to obtain the most critical properties of a cosmic ray, including the depth of shower maximum, energy, and type of primary particle, from radio measurements. Semnan University Radio Array is a new experi- ment that strives to detect radio emissions from extensive air showers induced by ultra-high energy cosmic rays. To fully harness the potential of the radio detection method in a self-trigger setup, it is essential to have artificial digital and analog filters to eliminate major unwanted emissions, analog-to-digital converters with appropriate specifications for accurate signal reconstruction, and data processing units capable of implementing software- based analysis alongside advanced digital signal processing techniques. This paper describes the design and implementation of a self-triggering approach in SURA-4 as the first phase of the SURA experiment to preserve cosmic ray candidates while removing unwanted emissions by utilizing the capabilities of analog and digital elements and incorporating a custom software framework for radio signal analyses. The ultimate validation of this approach for reliably distinguishing cosmic rays from anthropogenic radio frequency interferences will be pursued in future experiment phases, including cross-verification with three particle detectors."
2025_article_lip_students_25_24,". The sRPC detector is a supplementary detector for the SND@LHC experiment. It is a sealed Resis- tive Plate Chamber detector, which presents advantages over standard RPC detectors in operation reliability and environmental impact due to its ability to operate without gas flow. The detector was installed with the main purpose of calculating the flux of the important muon background created at the ATLAS experiment, so as to improve detection of neutrinos at SND@LHC. We have utilized data from a run of the LHC to obtain the muon flux, which is found to be 1.01 × 105 for an area of 30 × 21 cm2 , and 6.39 × 104 for an area of 30 × 30 cm2 . We have also utilized a Monte Carlo simulation as a model for the flux, obtaining deviations from the real result between 60% and 120%, and concluding that the simulated flux values were overestimated. Keywords: SND@LHC, muon flux, RPC"
2025_article_long_term_evolution_of_cosmic_ray_modulation_a_comprehensive,"PAPER • OPEN ACCESS You may also like - A Complete Census of Luminous Stellar Long-term evolution of cosmic ray modulation: a Variability on Day to Decade Timescales Charlie Conroy, Jay Strader, Pieter van comprehensive analysis of solar and heliospheric Dokkum et al."
2025_article_magnetopause_location_and_solar_wind_turbulence_level_during,"RESEARCH ARTICLE Magnetopause Location and Solar Wind Turbulence Level 10.1029/2025SW004453 During FDs and Their Impacts on the Global Electric Circuit Key Points: G. Li1,2 , S. Fu1,2,3 , X. C. Guo3, J. Tacza4 , T. Chen3, and J. W. Yue3 • In large PG‐effective Forbush de- creases (FDs), magnetosphere is 1 State Key Laboratory of Lunar and Planetary Sciences, Macau University of Science and Technology, Taipa, PR China, strongly compressed with subsolar 2 CNSA Macau Center for Space Exploration and Science, Taipa, PR China, 3State Key Laboratory of Solar Activity and standoff distance R0 < 7Re • The subsolar standoff distance R0 is Space Weather, National Space Science Center, Chinese Academy of Sciences, Beijing, PR China, 4Institute of Geophysics, smaller for larger values of the solar Polish Academy of Sciences, Warsaw, Poland wind plasma turbulence level • The magnitude of FD is greater for smaller R0 and stronger solar wind Abstract During Forbush decreases (FDs), the fluxes of high‐energy galactic cosmic rays (GCRs) are plasma turbulence suppressed. As a consequence, the ionization profile of the atmosphere is affected and the global electric circuit system is perturbed. Recently, using cosmic ray measurements from the Alpha Magnetic Spectrometer (AMS‐ Correspondence to: 02) onboard the International Space Station to classify FDs, Tacza et al. (2024, https://doi.org/10.1029/ G. Li, 2023SW003852) have shown that the potential gradients (PGs) in ground‐based measurements taken in fair gli@must.edu.mo weather conditions only show noticeable increases during large FDs, but not in smaller FDs. In this work, continuing Tacza et al. (2024, https://doi.org/10.1029/2023SW003852), we further examine why large FDs are Citation: PG‐effective but smaller FDs are not. For the events examined in Tacza et al. (2024, https://doi.org/10.1029/ Li, G., Fu, S., Guo, X. C., Tacza, J., Chen, T., & Yue, J. W. (2025). Magnetopause 2023SW003852), we compute the subsolar standoff distance R0 during FDs using both an empirical formula and location and solar wind turbulence level a magnetohydrodynamic (MHD) simulation. We find that PG‐effective and PG‐ineffective FDs naturally fall during FDs and their impacts on the global into two populations based on the subsolar standoff distance and the GCR flux amplitude decrease (A) as electric circuit. Space Weather, 23, e2025SW004453. https://doi.org/10.1029/ measured from AMS‐02. We also find the MHD turbulence level, as measured by the root mean square of δB, 2025SW004453 correlates with R0 . We extend the analysis to include all FDs as reported in Wang et al. (2023, https://doi.org/10. 3847/1538‐4357/acca1b), separating into Coronal Mass Ejection (CME) associated and Corotating Interaction Received 25 MAR 2025 Region associated two subclasses, and find this two population remain conspicuous. Based on our findings, we Accepted 2 JUN 2025 propose a new classification scheme of FDs. Author Contributions: Conceptualization: G. Li Plain Language Summary Highly energetic charged particles from diverse sources constantly Formal analysis: G. Li, S. Fu, J. Tacza bombard Earth's atmosphere, influencing our environment in various ways. Sometimes, when Coronal Mass Investigation: G. Li, S. Fu, X. C. Guo, Ejections (CMEs) engulf the Earth, the flux of these high‐energy particles can decrease abruptly. These are J. Tacza, T. Chen, J. W. Yue Methodology: G. Li termed as Forbush decreases (FDs). It has been suggested that the enhanced turbulence around the engulfing Writing – original draft: G. Li, S. Fu, CME is the cause of FDs. In this work, we focus on understanding how FDs influence Earth's near‐surface X. C. Guo, J. Tacza atmospheric electric field, also known as the potential gradient (PG). In an earlier work, we found that only very Writing – review & editing: G. Li, S. Fu, X. C. Guo, J. Tacza large FDs can affect PG. Here we examine how the magnetosphere is compressed by CMEs during both large and small FDs. We find that large FDs often correlate with smaller magnetosphere. This can be explained if CMEs that cause large FDs are also the ones that can compress more strongly the Earth's magnetosphere. We also find CIR‐induced FDs do not have strongly compressed magnetosphere. We suggest that when the magnetosphere is strongly compressed, the turbulence levels in the magnetosheath and inside the magnetosphere greatly enhance, and this enhancement helps to further reduce the cosmic ray flux, besides the engulfing CMEs."
2025_article_monolithic_plastic_scintillator_detectors_novel_concepts_and,"Monolithic Plastic Scintillator Detectors: Novel Concepts and Frontier Developments Hybrid SiPM Readout Architectures (Surface & Side Mounts) Monolithic plastic scintillator detectors – one-piece scintillation slabs rather than segmented strips or tiles – are being reimagined with hybrid readout schemes to improve spatial resolution and signal uniformity. In particular, researchers have explored placing Silicon Photomultipliers (SiPMs) on both the broad faces and the edges of a scintillator (“surface-mounted” and “side-mounted” sensors) to capture scintillation light from multiple vantage points. By combining signals from top/bottom surfaces and side facets, a more complete sampling of the photon distribution is obtained, mitigating position- dependent response non-uniformities. For example, a recent proton beam monitor uses a 25×25×1 mm³ EJ-204 plastic scintillator coupled to four SiPMs on its edges, allowing the particle’s incident position to be triangulated from the share of light each SiPM receives 1 . This prototype achieved ~2 mm (rms) spatial resolution for single protons, illustrating how multi-sided readout in a monolithic slab can rival finely segmented detectors 1 ."
2025_article_monolithic_scintillator_detectors_read_out_by_sipm_arrays_st,"Monolithic Scintillator Detectors Read Out by SiPM Arrays – State of the Art Background and Motivation Traditional cosmic muon detectors often use plastic scintillator segments (bars or tiles) read out at the edges by photomultipliers or SiPMs. A classic example is the CosmicWatch muon detector, which uses a single SiPM coupled to a 5×5×1 cm scintillator block 1 . Such single-sensor designs can detect muons but cannot localize the muon’s hit position on the scintillator, since they only measure the integrated light output of one monolithic piece 1 . Achieving spatial resolution normally requires breaking the detector into many small scintillator strips or tiles (forming a hodoscope or matrix of narrow counters). However, fine segmentation is costly – fabricating scintillators into many fine strips greatly increases material and processing expenses 2 . This motivates monolithic scintillator designs that preserve a continuous detection area while using multiple readout channels to infer the muon’s position."
2025_article_monolithic_vs_segmented_scintillator_detectors_in_modern_exp,"Monolithic vs. Segmented Scintillator Detectors in Modern Experiments Monolithic scintillator detectors refer to large, continuous scintillating blocks (plastic or inorganic) that are read out by arrays of photosensors (SiPMs, PMTs, etc.), as opposed to segmented scintillators which divide the detector volume into many smaller optically isolated pieces (tiles, bars, crystals) each with individual readout. This distinction is crucial in high-energy and nuclear physics experiments, as it impacts detector granularity, calibration, and performance. Over the last 10–15 years, most large experiments have continued to rely on segmented scintillators for calorimetry and tracking because of their well-understood reconstruction advantages, while monolithic designs are mainly explored in R&D prototypes and niche applications 1 . Below we survey how monolithic scintillators are being developed and applied at major labs (CERN, Fermilab, J-PARC/KEK, etc.), in both primary detector systems (calorimeters, trackers) and auxiliary systems (muon vetoes, beam monitors, timing layers). We also discuss the performance goals driving these designs – e.g. precision timing (tens of ps), spatial resolution (mm–cm scale), high channel count vs. cost – and the challenges (uniformity, calibration, cost, radiation hardness) that must be overcome for large-scale adoption."
2025_article_muon_tracker_with_unsegmented_plastic_scintillator_panels,The Journal of Science and Medicine Vol 3 No 2 (2021): The Journal of Science and Medicine Articles
2025_article_nuclear_instruments_and_methods_in_physics_research_a_1075_2,Nuclear Instruments and Methods in Physics Research A 1075 (2025) 170401
2025_article_performance_study_of_a_position_sensitive_plastic_scintillat,"For a long time, scintillator detectors have suffered from rela- tively weak spatial resolution due to various influencing factors. Additionally, the high cost of photomultiplier tubes (PMTs) has limited the widespread adoption of scintillator detectors as position-sensitive detectors in particle and nuclear physics ex- periments. In recent years, thanks to the rapid development of silicon photomultipliers (SiPMs), their excellent cost-performance ratio has led to a renewed interest in scintillator detectors in par- ticle and nuclear physics. This project provides a detailed dis- cussion of a detector based on scintillators coupled with SiPMs, ∗ Corresponding author Email address: sawxj@mail.ustc.edu.cn (Xinjian Wang )"
2025_article_ppet_investigating_the_muon_puzzle_with_j_pet_detectors,"µPPET: Investigating the Muon Puzzle with J-PET Detectors Alessio Porcelli 1,2,3, * , Kavya Valsan Eliyan 1,4 , Gabriel Moskal 4,5 , Nousaba Nasrin Protiti 2 , Diana Laura Sirghi 3,6,7 , Ermias Yitayew Beyene 1,4 , Neha Chug 1,4 , Catalina Curceanu 3 , Eryk Czerwiński 1,4 , Manish Das 1,4 , Marek Gorgol 8 , Jakub Hajduga 9 , Sharareh Jalali 1,4 , Bożena Jasińska 8 , Krzysztof Kacprzak 1,4 , Tevfik Kaplanoglu 1,4 , Łukasz Kapłon 1,4 , Kamila Kasperska 1,4 , Aleksander Khreptak 1,4 , Grzegorz Korcyl 1,4 , Tomasz Kozik 1,4 , Deepak Kumar 1,4 , Karol Kubat 1,4 , Edward Lisowski 10 , Filip Lisowski 10 , Justyna M˛edrala-Sowa 1,4 , Wiktor Mryka 1,4 , Simbarashe Moyo 1,4 , Szymon Niedźwiecki 1,4 , Szymon Parzych 1,4 , Piyush Pandey 1,4 , Elena Perez del Rio 1,4 , Bartłomiej Rachwał 9 , Martin Rädler 1,4 , Sushil Sharma 1,4 , Magdalena Skurzok 1,4 , Ewa Łucja Stȩpień 1,4 , Tomasz Szumlak 9 , Pooja Tanty 1,4 , Keyvan Tayefi Ardebili 1,4 , Satyam Tiwari 1,4 and Paweł Moskal 1,4"
2025_article_prepared_for_submission_to_jinst,"Atmospheric muons are important probes for studying primary cosmic rays and extensive air showers. Additionally, they constitute a significant background for many underground and deep-sea neutrino experiments, such as TRopIcal DEep-sea Neutrino Telescope (TRIDENT). Understanding the muon flux at various depths in the deep sea is essential for validating TRIDENT simulations and guiding the development of optimized trigger strategies. This paper introduces a novel device based on plastic scintillators and silicon photomultipliers (SiPMs) named MuonSLab, which is designed to measure muon flux in the deep sea and has the potential to be extended to other atmospheric muon property measurements. We discuss the design and instrumentation of MuonSLab and present results from several muon flux measurements, demonstrating its sensitivity to muon detection and its stability during operations across multiple locations."
2025_article_research_article_july_08_2025,"Muography, traditionally recognized as a potent instrument for imaging the internal structure of gigantic objects, has initialized various interdisciplinary applications. As the financial and labor costs of muography detector development hinder their massive applications, we develop a novel muon detector called MuGrid by coupling a monolithic plastic scintillator with a light guide array in order to achieve com- petitive spatial resolution while substantially reducing production costs. For a prototype detector in 30  30 cm2 , the intrinsic spatial resolu- tion has been optimized toward a millimeter scale. An outdoor field muography experiment was conducted to monitor two buildings for validation purposes. The test successfully resolved the geometric influence of architectural features based on the attenuation of muon flux in good agreement between experimental results and the simulation prediction."
2025_article_research_article_september_03_2025,"Muon tomography leverages cosmic-ray muons for non-destructive imaging of dense and shielded objects. However, large-area scintillator-based detectors typically require a high number of readout channels, increasing system complexity and cost. This work presents an optical multiplexing scheme that significantly reduces the number of required channels without compromising spatial resolution. In the proposed approach, photons from multiple scintillator strips are collected via wavelength-shifting fibers and read out by a single Silicon Photomultiplier (SiPM), with an addi-"
2025_article_research_article_september_18_2025,"21 September 2025 14:25:36 This work presents the design and experimental evaluation of muon trigger detectors tailored for industrial-scale applications. Studies were conducted using an organic scintillator plate measuring 250  250  10 mm3 , configured with varying numbers of silicon photomultiplier (SiPM) devices, each with a detection area of 4  4 mm2 . Various reflective materials, such as reflective paint, aluminum foil, and high-gloss paper, were applied to enhance the detected scintillation photon yield. Particular attention was given to optimize dark count suppression and muon event discrimination. Four detector configurations were designed, optimized, and evaluated individually. Spatially resolved muon detection efficiency was assessed using a muon coincidence detector with an active area of 50  50 mm2 . The assembly procedures for the different detector configurations are also discussed. Finally, a trigger detector configuration incorporating a single SiPM device coupled with a wavelength-shifting fiber clamp was identified as providing the most efficient collection for scintillation photon yield. This configuration is cost-effective, modular, and easy to mass-produce, making it well-suited for the developing of large-scale muon trigger detectors for industrial applications."
2025_article_rigidity_spectrum_of_cosmic_ray_anisotropy,Rigidity spectrum of cosmic-ray anisotropy observed by Global Muon Detector Network (GMDN)
2025_article_scaler_rates_from_the_pierre_auger_observatory_a_new_proxy_o,"The modulation of low-energy galactic cosmic rays reflects interplanetary magnetic field variations and can provide useful information on solar activity. An array of ground-surface detectors can reveal the secondary particles, which originate from the interaction of cosmic rays with the atmosphere. In this work, we present an investigation of the low-threshold rate (scaler) time series recorded in 16 yr of operation by the Pierre Auger Observatory surface detectors in Malargüe, Argentina. Through an advanced spectral analysis, we detected highly statistically significant variations in the time series with periods ranging from the decadal to the daily scale. We investigate their origin, revealing a direct connection with solar variability. Thanks to their intrinsic very low noise level, the Auger scalers allow a thorough and detailed investigation of the galactic cosmic-ray flux variations in the heliosphere at different timescales and can, therefore, be considered a new proxy of solar variability. Unified Astronomy Thesaurus concepts: Solar activity (1475); Cosmic ray detectors (325); Astronomy data analysis (1858)"
2025_article_sciadv_2025_11_downloaded_from_https_www_science_org_by_univ,"sciadv, 2025, 11, Downloaded from https://www.science.org. By Universidad Complutense de Madrid - on May 05, 2025. Re-use and distribution is strictly not permitted, except for Open Access articles sciadv, 2025, 11, Downloaded from https://www.science.org. By Universidad Complutense de Madrid - on May 05, 2025. Re-use and distribution is strictly not permitted, except for Open Access articles sciadv, 2025, 11, Downloaded from https://www.science.org. By Universidad Complutense de Madrid - on May 05, 2025. Re-use and distribution is strictly not permitted, except for Open Access articles sciadv, 2025, 11, Downloaded from https://www.science.org. By Universidad Complutense de Madrid - on May 05, 2025. Re-use and distribution is strictly not permitted, except for Open Access articles sciadv, 2025, 11, Downloaded from https://www.science.org. By Universidad Complutense de Madrid - on May 05, 2025. Re-use and distribution is strictly not permitted, except for Open Access articles sciadv, 2025, 11, Downloaded from https://www.science.org. By Universidad Complutense de Madrid - on May 05, 2025. Re-use and distribution is strictly not permitted, except for Open Access articles sciadv, 2025, 11, Downloaded from https://www.science.org. By Universidad Complutense de Madrid - on May 05, 2025. Re-use and distribution is strictly not permitted, except for Open Access articles sciadv, 2025, 11, Downloaded from https://www.science.org. By Universidad Complutense de Madrid - on May 05, 2025. Re-use and distribution is strictly not permitted, except for Open Access articles sciadv, 2025, 11, Downloaded from https://www.science.org. By Universidad Complutense de Madrid - on May 05, 2025. Re-use and distribution is strictly not permitted, except for Open Access articles sciadv, 2025, 11, Downloaded from https://www.science.org. By Universidad Complutense de Madrid - on May 05, 2025. Re-use and distribution is strictly not permitted, except for Open Access articles"
2025_article_some_interesting_observations_of_cosmic_ray_variations_durin,"Multiple interplanetary coronal mass ejections (ICMEs) erupted from AR 13664 during 2024 May 8–13. On 2024 May 10, after the arrival of the ICME shock at 17:04 UT, a Forbush Decrease (FD) was seen in various Neutron Monitor (NM) stations located worldwide. This paper presents a comprehensive analysis of neutron data from 28 NM stations and gamma-ray data obtained from the NaI(Tl) detector at Maitri, Antarctica. The present paper reports for the first time about an ICME shock-sheath related enhancement of ∼3%–5% magnitude in the neutron flux at stations with geomagnetic rigidity between 4 and 7 GV, located at higher altitudes (�1000 m). For these stations, the high-rigidity ends of the asymptotic trajectories are confined to the midnight to the postmidnight region. It appears that the increase may be associated with magnetospheric particle precipitation triggered by the passage of the ICME shock-sheath. The variation of FD amplitude with rigidity shows a decreasing trend in general, with a minimum amplitude at 5–7 GV, which we attribute to the location of field-aligned currents (FACs). The FD amplitude is found to have the effects of storm-time westward ring current, FACs, and magnetospheric dynamics, in addition to the ICME parameters. During the recovery phase of FD, enhancement is observed between 01:50 and 03:00 UT on 2024 May 11, which coincided with Ground Level Enhancement (GLE#74). The GLE#74 was coeval with the strong SYM-H index and the sudden recovery of the FD due to reduced interplanetary magnetic field, which might be responsible for the observed enhancement at high rigidity stations. Unified Astronomy Thesaurus concepts: Solar storm (1526); Solar coronal mass ejections (310); Shocks (2086); Galactic cosmic rays (567); Secondary cosmic rays (1438)"
2025_article_spectra_and_anisotropy_during_gle_74_on_11_may,Spectra and anisotropy during GLE 74 on 11 May 2024 derived using neutron monitor data
2025_article_strong_enhancement_of_electromagnetic_shower_development_in,"A particle traversing a crystal aligned with one with 120 GeV electrons and γ -rays between 5 and 100 GeV of its crystallographic axes experiences a strong electromag- demonstrate up to a threefold increase in energy deposition in netic field that is constant along the direction of motion oriented samples. These findings challenge the current mod- over macroscopic distances. For e± and γ -rays with ener- els of shower development in crystal scintillators and could gies above a few GeV, this field is amplified by the Lorentz guide the development of next-generation accelerator- and boost, to the point of exceeding the Schwinger critical field space-borne detectors. E0 ∼ 1.32 × 1016 V/cm. In this regime, nonlinear quantum- electrodynamical effects occur, such as the enhancement of intense electromagnetic radiation emission and pair pro- Introduction duction, so that the electromagnetic shower development is accelerated and the effective shower length is reduced com- Inorganic crystal scintillators are essential in high-energy, pared to amorphous materials. We have investigated this nuclear, medical and astroparticle physics, since they pro- phenomenon in lead tungstate (PbWO4 ), a high-Z scintil- vide precise measurements of the energy of electrons, lator widely used in particle detection. We have observed a positrons and γ -rays. In particular, numerous high-energy substantial increase in scintillation light at small incidence and astroparticle physics experiments rely on high-resolution angles with respect to the main lattice axes. Measurements electromagnetic calorimeters based on scintillating crystals, in which the energy of the incident particle is measured by a e-mail: mattia.soldani@lnf.infn.it (corresponding author) detecting the scintillation light resulting from the electro- b e-mail: bandiera@fe.infn.it magnetic shower it initiates [1]. At the energy frontier (i.e.,"
