code,abstract
1975_article_some_recent_developments_in_cosmic_rays,"NORTH-HOLLAND PUBLISHING COMPANY — AMSTERDAM PHYSICS REPORTS (Section C of Physics Letters) 20, no. 2 (1975) 59—136. NORTH-HOLLAND PUBLISHING COMPANY"
1999_article_volume_83_number_21_physical_review_letters_22_november_1999,"VOLUME 83, NUMBER 21 PHYSICAL REVIEW LETTERS 22 NOVEMBER 1999"
2000_article_a_new_high_resolution_tof_technology,"In the framework of the ALICE collaboration we have recently studied the performance of multigap Resistive Plate Chambers operated in avalanche mode and at atmospheric pressure for time-of-#ight measurements. The detector provided an overall (detector plus electronics) timing accuracy of 120 ps sigma at an e$ciency of 98% for MIPs. The chambers had four gas gaps of 0.3 mm, each limited by a metallised ceramic plate and a glass plate, with an active dimension of 4]4 cm2. The gas mixture contained C H F #5% isobutane#10% SF . A few percent of streamer 2 2 4 6 discharges, each releasing about 20 pC, was tolerated without any noticeable inconvenience. This detector opens perspectives of a!ordable and reliable high granularity large area TOF detectors, with an e$ciency and a time resolution comparable to existing scintillator-based TOF technology but with signi""cantly, up to an order of magnitude, lower price per channel. ( 2000 Elsevier Science B.V. All rights reserved."
2000_article_coronal_mass_ejections_and_forbush_decreases,". Coronal Mass Ejections (CMEs) are plasma eruptions from the solar atmosphere involving previously closed field regions which are expelled into the interplanetary medium. Such regions, and the shocks which they may generate, have pronounced effects on cosmic ray densities both locally and at some distance away. These energetic particle effects can often be used to identify CMEs in the interplanetary medium, where they are usually called ‘ejecta’. When both the ejecta and shock effects are present the resulting cosmic ray event is called a ‘classical, two-step’ Forbush decrease. This paper will summarize the characteristics of CMEs, their effects on particles and the present understanding of the mechanisms involved which cause the particle effects. The role of CMEs in long term modulation will also be discussed."
2000_article_introduccio_n_a_r,Introducción a R Notas sobre R: Un entorno de programación para Análisis de Datos y Gráficos Versión 1.0.1 (2000-05-16)
2000_article_muon_observations,". Muon observations are complementary to neutron monitor observations but there are some important differences in the two techniques. Unlike neutron monitors, muon telescope systems use coincidence techniques to obtain directional information about the arriving particle. Neutron monitor observations require simple corrections for pressure variations to compensate for the varying mass of atmospheric absorber over a site. In contrast, muon observations require additional corrections for the positive and negative temperature effects. Muon observations commenced many years before neutron monitors were constructed. Thus, muon data over a larger number of solar cycles is available to study solar modulation on anisotropies and other cosmic ray variations. The solar diurnal and semi-diurnal variations have been studied for many years. Using the tech- niques of Bieber and Chen it has been possible to derive the radial gradient, parallel mean-free path and symmetric latitude gradient of cosmic rays for rigidities <200 GV. The radial gradient varies with the 11-year solar activity cycle whereas the parallel mean-free path appears to vary with the 22- year solar magnetic cycle. The symmetric latitudinal gradient reverses at each solar polarity reversal. These results are in general agreement with predictions from modulation models. In undertaking these analyses the ratio of the parallel to perpendicular mean-free path must be assumed. There is strong contention in the literature about the correct value to employ but the results are sufficiently robust for this to be, at most, a minor problem. An asymmetric latitude gradient of highly variable nature has been found. These observations do not support current modulation models. Our view of the sidereal variation has undergone a revolution in recent times. Nagashima, Fuji- moto and Jacklyn proposed a narrow Tail-In source anisotropy and separate Loss-Cone anisotropy as being responsible for the observed variations. A new analysis technique, more amenable to such structures, was developed by Japanese and Australian researchers. They confirmed the existence of the two anisotropies. However, they found that the Tail-In anisotropy is asymmetric and that both anisotropies had different positions from the prediction. Most 27-day modulations are observed at neutron monitor rigidities but not so readily at higher rigidities. An exception to this is the Isotropic Intensity Wave modulation observed in the early 1980s and again in 1991. This modulation is very strongly related to the heliospheric sector structure and implies a significantly different cosmic ray density on either side of the neutral sheet. The interpretation of most cosmic ray modulation phenomena requires good latitude coverage in both hemispheres. The closure of many muon observatories is a matter of concern. In the northern hemisphere a few new instruments are being constructed and spatial coverage is barely adequate. In the southern hemisphere the situation is far worse with the possibility that within a decade only the Mawson observatory in Antarctica will still be in operation."
2000_book_escuela_superior_de_ingenieros_industriales,Escuela Superior de Ingenieros Industriales de San Sebastián UNIVERSIDAD DE NAVARRA
2001_article_j_phys_g_nucl_phys_10_1984_1609_1628_printed_in_great_britai,". The differential and integral spectra of muons moving in the near-vertical direction have been measured at Nottingham using a solid iron magnet spectrometer. This instrument utilised an automatic recording system for data collection which allowed the range of muon momenta covered by this investigation to extend from 4 to 3000 GeV/c. the lower limit being set by the magnet itself. The diffusion model for particle propagation through the Earth’s atmosphere was used to provide the muon momentum spectrum incident upon the instrument. A comparison of this spectrum, after modification by scattering and errors in the determination of the angular deflection, with the measured spectrum allowed a value of -2.72 i 0.0 1 to be assigned to the exponent of the primary spectrum. If a contribution to the sea-level muon flux from the decay of K mesons is included then better agreement between the theoretical and experimental spectra is obtained for a value of the exponent of -2.73 together with a K/n ratio at production of 0.087. However, when the muon momentum range is reduced to 28-3000 GeV/c the comparison between the measured and the theoretical spectra shows agreement for an exponent of -2.60 + 0.01 for 100% n-meson parentage. Further, the inclusion of K-meson decay in this case is inconclusive since it does not allow any sensible values to be assigned to the exponent or the contribution provided by this process."
2001_article_the_day_night_variation_of_cosmic_rays_intensity,                                
2002_article_6_nuclear_ins_urn_ntsand_methods_in_physics_research_b58_799,6 Nuclear Ins~urn~ntsand methods in Physics Research B58 (7991) 6-10 Nob-Holland
2002_article_the_absolute_cosmic_ray_muon_spectrum_at_sea_level,"O. C. A L L K O F E R , K. C A R S T E N S E N and W. D. DAU Institut 9rut R e i n e und Angewandte K e r n p h y s i k , University of K i e l , G e r m a n y"
2002_book_friedlander_offset,A THIN COSMIC RAIN A THIN COSMIC RAIN PA R T I C L E S F R O M O U T E R S PA C E
2003_article_measurement_of_the_east_west_asymmetry_of_the_cosmic_muon_fl,The east–west asymmetry of the cosmic muon flux has been measured in Hanoi where the geomagnetic rigidity cut-off reaches its maximal value of 17 GV. The measurement was made using an orientable scintillator telescope that had been previously used to measure the zenith angle distribution of the cosmic muon flux in the direction of the geographic north. The data exhibit a clear east–west asymmetry in good agreement with the predictions of a model widely used in the analysis of atmospheric neutrino oscillation studies.  2003 Elsevier B.V. All rights reserved.
2003_article_measurement_of_the_zenith_angle_distribution_of_the_cosmic_m,"The zenith angle distribution of the cosmic muon flux has been measured in Hanoi, where the geomagnetic rigidity cutoff reaches the very high value of 17 GV, using an orientable scintillator telescope. The measurement is of interest for the understanding of the development of cosmic ray showers in the earth atmosphere. The dependence of the cosmic muon flux (integrated over charges and momenta) on zenith angle θ is measured to be of the approximate form (Φ0 − a sin2 θ) × cos2 θ with Φ0 = 72.0 ± 1.6 m−2 sr−1 s−1 and a = 7.8 ± 0.8 m−2 sr−1 s−1 . This result is consistent with an earlier Hanoi measurement and is in excellent agreement with the prediction of a model widely used in the analysis of atmospheric neutrino data.  2003 Elsevier Science B.V. All rights reserved."
2004_article_cosmic_ray_muon_observation_at_southern_space_observatory_x2,". Under an agreement on scientific cooperation between Brazil and Japan, a prototype detector of cosmic ray muons has been operating since March 2001 at Southern Space Observatory (SSO) located at São Martinho da Serra (29◦ S, 53◦ W), Brazil, in order to observe cosmic ray precursors of geomagnetic storms. This detector plays a key roll in the prototype network of muon observations together with two larger detectors operating in Japan and Australia. The planned extension of the detector in its size will complete the global coverage of our muon detector network. The prototype network has already discovered cosmic ray precursors of several magnetic storms, as reported by Munakata et al. (Munakata, K. et al.: 2000, J Geophys Res. 105, A12, pp. 27, 457–27, 468; Munakata K. et al.: 2001, Proceedings of ICRC.) We have also observed the Forbush Decreases (FDs), as well as the precursory enhancements of cosmic ray anisotropy preceding the onsets of geomagnetic storms. This report presents the description of the network and some results obtained since the prototype detector implementation."
2004_article_forbush_decreases_in_the_cosmic_radiation,". The experimental observations of Forbush decreases in recent years are reviewed and related to different theoretical models which have been proposed. The observational data from both ground-based and spacecraft experiments were selected to illustrate the important charac- teristics of Forbush decreases. The form of the rigidity dependence of the cosmic-ray modulation during the decreases and effects of the geomagnetic field upon the magnitude of the decreases are discussed. Recent results to deduce the cosmic-ray flow patterns from the observed anisotropies during the decreases are presented. Other features such as differences in onset times, recovery times, precursory increases are discussed. In considering the theoretical models particular emphasis is placed upon the agreement of the predictions of the model with the experimental observations. A theoretical model is suggested which is not original but represents a synthesis of several models previously proposed. Future important measurements and analyses necessary to an understanding of Forbush decreases are outlined."
2004_article_introductory_nuclear_physics,"JOHN WlLEY & SONS New York Chichester Brisbane Toronto Singapore Copyright 0 1988, by John Wiley & Sons, Inc. All rights reserved. Published simultaneously in Canada. Reproduction or translation of any part of this work beyond that permitted by Sections 107 and 108 of the 1976 United States Copyright Act without the permission of the copyright owner is unlawful. Requests for permission or further information should be addressed to the Permissions Department, John Wiley & Sons."
2004_article_properties_and_performance_of_the_prototype_instrument_for_t,"Construction of the ﬁrst stage of the Pierre Auger Observatory has begun. The aim of the Observatory is to collect unprecedented information about cosmic rays above 1018 eV: The ﬁrst phase of the project, the construction and operation of a prototype system, known as the engineering array, has now been completed. It has allowed all of the sub-systems that will be used in the full instrument to be tested under ﬁeld conditions. In this paper, the properties and performance of these sub-systems are described and their success illustrated with descriptions of some of the events recorded thus far. r 2003 Elsevier B.V. All rights reserved."
2004_book_introductory_nuclear_physics,"JOHN WlLEY & SONS New York Chichester Brisbane Toronto Singapore Copyright 0 1988, by John Wiley & Sons, Inc. All rights reserved. Published simultaneously in Canada. Reproduction or translation of any part of this work beyond that permitted by Sections 107 and 108 of the 1976 United States Copyright Act without the permission of the copyright owner is unlawful. Requests for permission or further information should be addressed to the Permissions Department, John Wiley & Sons."
2005_article_a_large_area_muon_tracking_detector_for_ultra_high_energy_co,"Certain aspects of ultra-high energy (UHE) cosmic ray astrophysics require correlated studies on the electron and muon components of air showers, namely, the search for cosmic ray sources through g-ray astronomy and studies on the variation of the nuclear composition of primary cosmic rays with energy. While studies on the electron component provide basic information about the arrival direction and energy, it is the muon component that plays a crucial role in distinguishing primary g-rays from charged cosmic ray particles and in determining the composition. A large area (560 m2 ), tracking muon detector of the GRAPES-3 experiment, operating at Ooty in southern India, has been designed for detailed studies on both of these aspects of UHE cosmic ray astrophysics. We present here the details of the muon detector, associated electronics and the data acquisition system. A brief discussion of the potential of the muon detector is presented through simulation studies. r 2005 Elsevier B.V. All rights reserved."
2005_article_correlated_measurements_of_secondary_cosmic_ray_fluxes_by_th,"The Aragats Space-Environmental Center provides monitoring of different species of secondary cosmic rays at two altitudes and with different energy thresholds. One-minute data is available on-line from http://crdlx5.yerphi.am/ DVIN/index2.php. We present description of the main monitors along with data acquisition electronics. Also we demonstrate the sensitivity of the different species of secondary cosmic ray ﬂux to geophysical conditions, taking as examples the extremely violent events of October–November 2003. We introduce correlation analysis of the dif- ferent components of registered time-series as a new tool for the classiﬁcation of the geoeffective (events on"
2005_book_circuitos_microelectr_nicos,Summary unavailable from PDF text. Topic: Circuitos microelectrónicos.
2005_book_physics_of_atoms_and_molecules,Summary unavailable from PDF text. Topic: Physics of atoms and molecules.
2006_article_real_time_cosmic_ray_monitoring_system_for_space_weather,"SPACE WEATHER, VOL. 4, S08001, doi:10.1029/2005SW000204, 2006"
2006_article_the_charge_ratio_of_the_atmospheric_muons_at_low_energy,"The charge ratio of the atmospheric muons at low energy M. Bahmanabadi,1,2,* F. Sheidaei,1 M. Khakian Ghomi,2 and J. Samimi1,2 1 Department of Physics, Sharif University of Technology, P.O.Box 11365-9161, Tehran, Iran 2 ALBORZ Observatory, Sharif University of Technology, Tehran, Iran (Received 22 October 2005; published 18 October 2006) From the nature of the muon production processes, it can be seen that the ratio of positive to negative cosmic muons has important information in both ‘‘the atmospheric neutrino problem,’’ and ‘‘the hadronic interactions.’’ We have carried out an experiment for the measurement of the muon charge ratio in the cosmic ray flux in momentum range 0:112–0:178 GeV=c. The muon charge ratio is found to be 1:21  0:01 with a mean zenith angle of 32  5 . From the measurements it has been obtained a zenithal angle distribution of muons as I  I0cosn  with n  1:95  0:13. An asymmetry has been observed in East-West directions because of the geomagnetic field. Meanwhile, in about the same momentum range, positive and negative muons have been studied on the basis of Monte Carlo simulations of the extensive air shower developement (Cosmic Ray Simulations for Kascade), using the Quark Gluon String model with JETs model as generator."
2006_book_optimization_theory_and_methods,Summary unavailable from PDF text. Topic: Optimization theory and methods.
2007_article_670_ieee_transactions_on_nuclear_science_vol_54_no_3_june_20,"—We have measured the Cosmic Ray absolute flux and its variations caused by the “day-night” and the “barometric” ef- fects, by using a telescope of Resistive Plate Chamber (RPC) de- tectors. Because of the high sensitivity needed for this measure, the RPC behaviour must be very well controlled and all the influences induced by the environmental parameters, must be compensated. For this purpose we introduced, among others features, an alter- native method for the stabilization of the RPC working point. We present here all the results for both aspects: the Cosmic Ray flux measurements, the barometric effect and a description of the RPC stabilization method used. Index Terms—Cosmic rays, electronics, gas detectors, triggering."
2007_article_investigations_of_a_thgem_based_imaging_detector,"We present the results of our recent studies on a Thick Gas Electron Multiplier (THGEM)-based imaging detector prototype. It consists of two 100x100 mm2 THGEM electrodes in cascade, coupled to a resistive anode. The event location is recorded with a 2D double-sided readout electrode equipped with discrete delay-lines and dedicated electronics. The THGEM electrodes, produced by standard printed-circuit board and mechanical drilling techniques, a 0.4 mm thick with 0.5 mm diameter holes spaced by 1 mm. Localization resolutions of about 0.7 mm (FWHM) were measured with soft x-rays, in a detector operated with atmospheric-pressure Ar/CH4; good linearity and homogeneity were achieved. We describe the imaging-detector layout, the resistive-anode 2D readout system and the imaging properties. The THGEM has numerous potential applications that require large-area imaging detectors, with high-rate capability, single-electron sensitivity and moderate (sub-mm) localization resolution."
2007_article_journalof_geophysicalresearch_vol_70_no_17_september1_1965,". Using sixth degreesimulationsof the quiescentgeomagneticfield, we have stud- ied the vertical cutoff rigidities of more than three hundredpositionson the earth's surface. Twenty-six of these positionsare near the South African magnetic anomaly, and six other points are in a region of the North Atlantic where Pomerantz and Agarwal have reported anomalousresults. The cutoff rigidities have been obtained by detailed computation of the trajectoriesof cosmicraysat 0.01-byrigidity intervalsto allow for the effectsof the penumbra. Differencesgreater than 15% from the Quenby and Wenk threshold values have been found in the vicinity of South Africa, the South Atlantic, and the Canary Islands.Various latitude surveys are shown to exhibit consistencywhen plotted against the cutoff rigidities determined by this computationalmethod. It is concludedthat, though there is essentiallyno difference between the cutoff rigidities obtained using two currently acceptedfield models,these simula- tions of the geomagneticfield are not completely adequate over some parts of the earth to describe the cosmic-rayeffects in their entirety. Cutoff rigidities for a number of neutron monitors are listed."
2007_book_cosmic_rays_at_earth,Summary unavailable from PDF text. Topic: Cosmic rays at earth.
2007_book_sakurai_modern_quantum_mechanics,Summary unavailable from PDF text. Topic: Sakurai modern quantum mechanics.
2007_book_statistical_mechanics_algorithms_and_computations_oxford_mas,"OXFORD MASTER SERIES IN STATISTICAL, COMPUTATIONAL, AND THEORETICAL PHYSICS OXFORD MASTER SERIES IN PHYSICS"
2008_article_first_spaceweather_observations_at_mustang_the_muon_spacewea,First results of the Muon Spaceweather Telescope for Anisotropies at Greifswald (MuSTAnG) that is dedicated to spaceweather forecasting are reported.
2008_book_modern_optics,Summary unavailable from PDF text. Topic: Modern optics.
2008_book_solvingordinarydifferentialequ_1,Summary unavailable from PDF text. Topic: Solvingordinarydifferentialequ 1.
2009_article_afcrl_72_0411,"A comprehensive listing of ground-based cosmic-ray detectors in operation from 1932 through 1971 has been assembled and the pertinent information and data availability of each sensor is given. The cosmic-ray instrumentation cataloged consists of neutron monitors, muon detectors and ionixation chambers."
2009_article_particle_physics,Summary unavailable from PDF text. Topic: Particle physics.
2009_article_revista_i_encuentro_divulgacion,"IMAGEN MÉDICA MEDIANTE TOMOGRAFÍA POR EMISIÓN DE POSITRONES (PET) J. Cal-González, E. Vicente, J. L. Herraiz, S. España, E. Herranz, J. M. Udías Grupo de Física Nuclear, Dpto. Física Atómica, Molecular y Nuclear, UCM"
2009_article_status_performance_and_first_results_of_the_icetop_array,Nuclear Physics B (Proc. Suppl.) 196 (2009) 159–164 www.elsevier.com/locate/npbps
2009_article_zenith_angle_response_of_a_vertical_meson_telescope,"Expressions have been obtained for the Geometrical Sensitivity a s a function of the zenith angle of a cosmic ray telescope comp¡ of counter trays of rectangular dimensions. The Radiation Sensitivity and Cumulative Sensitivity have also been calculated, assuming a zenith angle attenuation of the form I0 = Io .coszO for cosmic ray intensity."
2009_book_solid_state_physics_an_introduction_to_p,Summary unavailable from PDF text. Topic: Solid state physics an introduction to p.
